{
  "$schema": "../../contracts/json-schema/nbti-questionnaire.v1.schema.json",
  "schemaVersion": "1.0.0",
  "kind": "nbti.questionnaire",
  "id": "nbti-mvp",
  "version": "1",
  "contentDigest": "sha256:cab42a7aa8b5d96ac65c9448c111fe28f8433d32d8a281fc3911908210f187d7",
  "locale": "zh-CN",
  "title": "NBTI 思维风格测试",
  "questionCount": 12,
  "safety": {
    "notDiagnosis": true,
    "notPersonalityAssessment": true,
    "notAbilityRating": true,
    "statement": "结果只描述回答者在本组复杂情境中通常怎样处理信息和作出判断，不构成心理诊断、人格测评或能力评级。"
  },
  "dimensions": [
    {
      "id": "organization",
      "label": "组织方式",
      "left": { "id": "decompose", "label": "拆解" },
      "right": { "id": "associate", "label": "联想" },
      "explanation": "拆解倾向先把问题分开处理；联想倾向先寻找事物之间的连接。"
    },
    {
      "id": "calibration",
      "label": "校准依据",
      "left": { "id": "evidence", "label": "证据" },
      "right": { "id": "context", "label": "语境" },
      "explanation": "证据倾向先检查可验证依据；语境倾向先理解现场条件与关系。"
    },
    {
      "id": "momentum",
      "label": "推进方式",
      "left": { "id": "anchor", "label": "定锚" },
      "right": { "id": "probe", "label": "试探" },
      "explanation": "定锚倾向先形成可执行结论；试探倾向先用小步行动换取新信息。"
    },
    {
      "id": "scope",
      "label": "关注范围",
      "left": { "id": "global", "label": "全局" },
      "right": { "id": "proximate", "label": "近身" },
      "explanation": "全局倾向先看系统和长期影响；近身倾向先看眼前具体的人与体验。"
    }
  ],
  "questions": [
    {
      "id": "q01",
      "order": 1,
      "tag": "协作现场",
      "title": "含糊目标分歧",
      "prompt": "群聊里大家对“什么才算做成了”越聊越散，明早就要开工。你的第一反应是？",
      "options": [
        {
          "id": "q01-0",
          "label": "把目标拆成可独立验证的几个子目标",
          "action": "把混在一起的目标拆成可分别讨论的部分",
          "weights": { "organization": -2, "calibration": 0, "momentum": 0, "scope": 0 }
        },
        {
          "id": "q01-1",
          "label": "找出不同目标之间的隐藏关联，重新拼成一个整体",
          "action": "在看似独立的目标之间寻找联系",
          "weights": { "organization": 2, "calibration": 0, "momentum": 0, "scope": 0 }
        },
        {
          "id": "q01-2",
          "label": "拉起一张全局影响地图，看长期后果",
          "action": "把眼前的分歧放到长期影响里评估",
          "weights": { "organization": 0, "calibration": 0, "momentum": 0, "scope": -2 }
        },
        {
          "id": "q01-3",
          "label": "分别了解每个人说法背后的真实处境",
          "action": "先倾听不同人的具体处境",
          "weights": { "organization": 0, "calibration": 0, "momentum": 0, "scope": 2 }
        }
      ]
    },
    {
      "id": "q02",
      "order": 2,
      "tag": "信息现场",
      "title": "新信息冲突",
      "prompt": "方案已经跑到一半，突然冒出一组数据，说原计划的关键前提可能不成立。你先动哪一步？",
      "options": [
        {
          "id": "q02-0",
          "label": "先查这组数据的来源、时间范围和采集条件",
          "action": "先核对新数据的来源、口径和适用范围",
          "weights": { "organization": 0, "calibration": -2, "momentum": 0, "scope": 0 }
        },
        {
          "id": "q02-1",
          "label": "重新理解这条数据产生的现场条件",
          "action": "先理解数据产生的具体语境",
          "weights": { "organization": 0, "calibration": 2, "momentum": 0, "scope": 0 }
        },
        {
          "id": "q02-2",
          "label": "先做一个最小调整，看现场反应",
          "action": "用可逆的小动作测试新方向",
          "weights": { "organization": 0, "calibration": 0, "momentum": 2, "scope": 0 }
        },
        {
          "id": "q02-3",
          "label": "先按原结论执行，把新数据留到会后核实",
          "action": "先保留既有结论，再继续推进",
          "weights": { "organization": 0, "calibration": 0, "momentum": -2, "scope": 0 }
        }
      ]
    },
    {
      "id": "q03",
      "order": 3,
      "tag": "信息现场",
      "title": "证据不完整",
      "prompt": "离截止只剩两小时，两组关键数据还在互相打架，团队都在等你拍板。你会先做什么？",
      "options": [
        {
          "id": "q03-0",
          "label": "把矛盾拆成可以分别核对的部分",
          "action": "把互相矛盾的数据拆成可逐项核对的部分",
          "weights": { "organization": -2, "calibration": 0, "momentum": 0, "scope": 0 }
        },
        {
          "id": "q03-1",
          "label": "找一个让两组数据可能同时成立的条件",
          "action": "寻找能同时解释两组数据的现场条件",
          "weights": { "organization": 2, "calibration": 0, "momentum": 0, "scope": 0 }
        },
        {
          "id": "q03-2",
          "label": "先确认哪条证据最可能改变结论",
          "action": "优先验证最能影响结论的证据",
          "weights": { "organization": 0, "calibration": -2, "momentum": 0, "scope": 0 }
        },
        {
          "id": "q03-3",
          "label": "先问清不同人会承担什么后果",
          "action": "先了解决定落地后各方的真实处境",
          "weights": { "organization": 0, "calibration": 2, "momentum": 0, "scope": 0 }
        }
      ]
    },
    {
      "id": "q04",
      "order": 4,
      "tag": "协作现场",
      "title": "多方利益冲突",
      "prompt": "两个团队都说自己的需求不能再等，但预算只够先做一边。你会先怎么处理？",
      "options": [
        {
          "id": "q04-0",
          "label": "先定一个优先级规则，按规则执行",
          "action": "先用规则给出一个明确落点",
          "weights": { "organization": 0, "calibration": 0, "momentum": -2, "scope": 0 }
        },
        {
          "id": "q04-1",
          "label": "先小规模试行一个兼顾方案",
          "action": "用一个小试验验证兼顾方案是否可行",
          "weights": { "organization": 0, "calibration": 0, "momentum": 2, "scope": 0 }
        },
        {
          "id": "q04-2",
          "label": "评估对整体业务链路的长期影响",
          "action": "把冲突放到整体业务里看长期后果",
          "weights": { "organization": 0, "calibration": 0, "momentum": 0, "scope": -2 }
        },
        {
          "id": "q04-3",
          "label": "分别了解两个部门的真实处境",
          "action": "先了解两个部门各自的真实处境",
          "weights": { "organization": 0, "calibration": 0, "momentum": 0, "scope": 2 }
        }
      ]
    },
    {
      "id": "q05",
      "order": 5,
      "tag": "信息现场",
      "title": "指标异常",
      "prompt": "后台一个核心指标突然跳水，群里已经有人喊“出大事了”，但原因还不明。你先做什么？",
      "options": [
        {
          "id": "q05-0",
          "label": "核对最近变更、样本范围和数据口径",
          "action": "先核对变更记录、样本范围和统计口径",
          "weights": { "organization": 0, "calibration": -2, "momentum": 0, "scope": 0 }
        },
        {
          "id": "q05-1",
          "label": "先打电话问一线同事现场发生了什么",
          "action": "先从一线同事那里了解现场情况",
          "weights": { "organization": 0, "calibration": 2, "momentum": 0, "scope": 0 }
        },
        {
          "id": "q05-2",
          "label": "评估如果持续异常，整体目标会受多大影响",
          "action": "把指标异常放到整体目标里评估",
          "weights": { "organization": 0, "calibration": 0, "momentum": 0, "scope": -2 }
        },
        {
          "id": "q05-3",
          "label": "定位指标异常影响到的具体用户场景",
          "action": "先找到被影响的具体用户场景",
          "weights": { "organization": 0, "calibration": 0, "momentum": 0, "scope": 2 }
        }
      ]
    },
    {
      "id": "q06",
      "order": 6,
      "tag": "关系现场",
      "title": "冒险想法",
      "prompt": "朋友半夜甩来一个“可能起飞”的计划，想让你立刻上车。你的第一反应是？",
      "options": [
        {
          "id": "q06-0",
          "label": "请他列出可能失败的具体环节",
          "action": "把计划拆成可能出问题的具体环节",
          "weights": { "organization": -2, "calibration": 0, "momentum": 0, "scope": 0 }
        },
        {
          "id": "q06-1",
          "label": "找出这个想法和他过往经历的连接",
          "action": "把他的新想法和过往经历联系起来",
          "weights": { "organization": 2, "calibration": 0, "momentum": 0, "scope": 0 }
        },
        {
          "id": "q06-2",
          "label": "建议先投入一小段时间试水",
          "action": "用一段小时间验证想法是否可行",
          "weights": { "organization": 0, "calibration": 0, "momentum": 2, "scope": 0 }
        },
        {
          "id": "q06-3",
          "label": "先明确表态支持或反对，再慢慢评估",
          "action": "先给出一个明确立场再继续讨论",
          "weights": { "organization": 0, "calibration": 0, "momentum": -2, "scope": 0 }
        }
      ]
    },
    {
      "id": "q07",
      "order": 7,
      "tag": "协作现场",
      "title": "观点对撞",
      "prompt": "一场重要讨论逐渐变成互相抬杠，观点越说越多，事情一点没动。你先做什么？",
      "options": [
        {
          "id": "q07-0",
          "label": "把双方论点放到同一组标准下逐项比较",
          "action": "用同一组标准比较双方论点与依据",
          "weights": { "organization": -2, "calibration": 0, "momentum": 0, "scope": 0 }
        },
        {
          "id": "q07-1",
          "label": "寻找不同观点之间的共同前提",
          "action": "在分歧背后寻找共同的前提",
          "weights": { "organization": 2, "calibration": 0, "momentum": 0, "scope": 0 }
        },
        {
          "id": "q07-2",
          "label": "把讨论放到整体目标里看优先级",
          "action": "把争论放到整体目标里看优先级",
          "weights": { "organization": 0, "calibration": 0, "momentum": 0, "scope": -2 }
        },
        {
          "id": "q07-3",
          "label": "停下来，分别听每个人的情绪和立场",
          "action": "先停下来倾听每个人的情绪和立场",
          "weights": { "organization": 0, "calibration": 0, "momentum": 0, "scope": 2 }
        }
      ]
    },
    {
      "id": "q08",
      "order": 8,
      "tag": "决策现场",
      "title": "修局部还是重做",
      "prompt": "一个老问题反复复发：有人要推倒重来，有人说先打补丁。你会先怎么起手？",
      "options": [
        {
          "id": "q08-0",
          "label": "收集历史上同类决策的真实数据",
          "action": "用历史数据判断同类决策的结果",
          "weights": { "organization": 0, "calibration": -2, "momentum": 0, "scope": 0 }
        },
        {
          "id": "q08-1",
          "label": "了解当前团队能承受的改动范围",
          "action": "先了解团队当下的实际承受范围",
          "weights": { "organization": 0, "calibration": 2, "momentum": 0, "scope": 0 }
        },
        {
          "id": "q08-2",
          "label": "先定一个临时方向和复盘节点，结束空转",
          "action": "先建立临时落点，并约定重新检查的节点",
          "weights": { "organization": 0, "calibration": 0, "momentum": -2, "scope": 0 }
        },
        {
          "id": "q08-3",
          "label": "先做一个最小、可回滚的切口验证重做假设",
          "action": "用可回滚的小切口验证重做是否值得",
          "weights": { "organization": 0, "calibration": 0, "momentum": 2, "scope": 0 }
        }
      ]
    },
    {
      "id": "q09",
      "order": 9,
      "tag": "表达现场",
      "title": "公开表达",
      "prompt": "你要把一件复杂的事发到公开平台，又担心一句话被截图带走。你会先做什么？",
      "options": [
        {
          "id": "q09-0",
          "label": "把论点拆成几个不易误解的小命题",
          "action": "把复杂论点拆成可独立理解的小命题",
          "weights": { "organization": -2, "calibration": 0, "momentum": 0, "scope": 0 }
        },
        {